,Company Name,Company Purpose
0,Gaines Inc,Secured clear-thinking monitoring for productize strategic eyeballs
1,James Inc,Inverse systemic focus group for embrace compelling architectures
2,Lopez-Carlson,Future-proofed 3rdgeneration encoding for monetize impactful technologies
3,Thompson-Perez,Universal interactive process improvement for expedite front-end vortals
4,Sanders LLC,Team-oriented full-range open architecture for strategize strategic architectures
5,Bonilla-Perez,Optimized tertiary strategy for seize innovative experiences
6,Martin Ltd,Integrated multi-tasking algorithm for implement virtual e-markets
7,Kelley Ltd,Enhanced full-range methodology for revolutionize robust paradigms
8,Hanson and Sons,Implemented well-modulated moratorium for synthesize 24/365 e-commerce
9,Giles-Hunter,Exclusive reciprocal matrix for envisioneer transparent web services
10,Rodriguez-Wells,Secured national definition for revolutionize frictionless mindshare
11,Lopez-Mueller,Integrated directional concept for synthesize virtual web services
12,"Davis, Holmes and Meza",Profit-focused heuristic strategy for iterate open-source architectures
13,"Stephens, Welch and Robinson",Programmable mission-critical service-desk for utilize 24/7 initiatives
14,Brennan Inc,Optimized non-volatile monitoring for revolutionize efficient communities
15,Walker-Taylor,Profit-focused fault-tolerant collaboration for e-enable collaborative paradigms
16,"Casey, Steele and Taylor",Inverse 5thgeneration model for streamline integrated e-markets
17,Taylor-Mathis,Synergized empowering alliance for evolve magnetic action-items
18,"Bruce, Diaz and Harrington",Diverse regional neural-net for drive magnetic e-services
19,"May, Gates and Carter",Re-engineered 6thgeneration migration for visualize best-of-breed web services
20,Velazquez and Sons,Networked reciprocal Local Area Network for extend best-of-breed bandwidth
21,"Williamson, Little and Thompson",Enhanced demand-driven contingency for extend vertical solutions
22,Patel Group,Assimilated uniform adapter for streamline cutting-edge e-business
23,"Smith, Davis and Williams",Vision-oriented systematic orchestration for generate leading-edge initiatives
24,Moore-Caldwell,Reverse-engineered uniform adapter for harness 24/7 channels
25,"Dickerson, Stevens and Lewis",Advanced background paradigm for visualize mission-critical vortals
26,"Medina, Nichols and Woods",Extended intermediate system engine for strategize customized methodologies
27,George LLC,Synchronized even-keeled monitoring for embrace back-end markets
28,Wells-Buck,Profound human-resource database for incentivize customized niches
29,"Jensen, Mitchell and Bean",Reactive multi-tasking standardization for aggregate real-time markets
30,Duncan Group,Profit-focused dynamic methodology for transform e-business experiences
31,"Russell, Whitaker and Gibson",Focused modular open architecture for exploit compelling synergies
32,Carter-Lynch,Public-key 24hour definition for optimize visionary channels
33,"Hood, Ross and Diaz",Cross-group context-sensitive Internet solution for deploy cross-platform portals
34,"Owens, Yu and Nelson",Visionary analyzing complexity for embrace front-end e-commerce
35,Banks-Walls,Total contextually-based function for innovate intuitive paradigms
36,"Gonzalez, Johnson and Wong",Cross-platform value-added hierarchy for engineer vertical mindshare
37,Martin-Griffin,Multi-lateral bandwidth-monitored migration for strategize integrated e-business
38,Clark PLC,Intuitive empowering parallelism for evolve virtual functionalities
39,Becker-Johnson,Open-source hybrid archive for scale collaborative channels
40,Dunn PLC,Networked grid-enabled extranet for transition clicks-and-mortar applications
41,Wyatt Ltd,Public-key grid-enabled concept for enhance enterprise e-commerce
42,Osborne-Flores,Proactive eco-centric matrix for redefine back-end relationships
43,"Gaines, Barber and Grimes",Organized cohesive data-warehouse for visualize B2B mindshare
44,Carlson Ltd,Business-focused directional function for optimize efficient convergence
45,"Hoffman, Green and Patel",Grass-roots upward-trending collaboration for harness frictionless experiences
46,Garcia LLC,Multi-tiered radical matrices for aggregate strategic initiatives
47,"Johnson, Wheeler and Simmons",Balanced bandwidth-monitored conglomeration for unleash collaborative architectures
48,"Shaw, Alvarez and Glass",Programmable local customer loyalty for streamline revolutionary action-items
49,"Mercado, Martinez and Abbott",Upgradable leadingedge application for maximize out-of-the-box convergence
